{
  "id": "endue.toolbar",
  "name": "Status",
  "version": "0.1.0",
  "kind": "ui",
  "entry": "ui/index.html",
  "description": "The right status panel: a list of drawers that say how the desk is doing.",
  "permissions": [{ "permission": "plugin:manage" }],
  "surfaces": [{ "id": "main", "title": "Status", "placement": "right" }]
}
